{
  "artifact_paths": [
    "[WORKSPACE]/[REDACTED]/VEHBench-DiagBench/artifacts/runs/p3_p4_v3r1_live/model_A/p3/test_ood/p3_results.jsonl",
    "[WORKSPACE]/[REDACTED]/VEHBench-DiagBench/artifacts/runs/p3_p4_v3r1_live/model_A/p3/test_ood/p3_trajectories.jsonl"
  ],
  "code_commit_hash": "55ed1f84e0d605a89605f7f2908d1d5e71499ddd",
  "input_manifest_hash": "5ce0d7504c85f8a620ec223a06878aecaa0fd99a68a4bac815cedc332b232dab",
  "jitter_policy": {
    "enabled": false,
    "scale": 0.0
  },
  "model_config": {
    "max_tokens": 512,
    "model_id": "model_A",
    "provider": "qwen",
    "reasoning_effort": "default",
    "temperature": 0.0,
    "top_p": 1.0
  },
  "model_endpoint": "https://dashscope.aliyuncs.com/compatible-mode/v1",
  "model_name": "model_A",
  "output_artifact_path": "[WORKSPACE]/[REDACTED]/VEHBench-DiagBench/artifacts/runs/p3_p4_v3r1_live/model_A/p3/test_ood/p3_results.jsonl",
  "retry_policy": {
    "backoff_s": 0.0,
    "max_retries": 0
  },
  "run_id": "model_A::5ce0d7504c85",
  "solver_config_version": "iterative_solver_v1",
  "solver_policy": {
    "action_schema_version": "action_schema_v2",
    "hard_timeout_s": 15.0,
    "max_attempts": 6,
    "policy_name": "iterative_design_search"
  },
  "system_prompt_hash": "c5d55a6b69fa0ed26effc8d04788d58f1d56e420846fd2eeecc55b22a1bbb476",
  "system_prompt_version": "qwen_iterative_v1",
  "task_bank_path": "[WORKSPACE]/[REDACTED]/VEHBench-DiagBench/data/p3_v3r1/p3_test_ood_tasks.jsonl",
  "task_bank_version": "p3_v3r1",
  "timeout_policy": {
    "hard_timeout_s": 15.0,
    "request_timeout_s": 10.0
  },
  "timestamp": "2026-04-14T14:12:04.814882+00:00"
}
