{
  "artifact_paths": [
    "artifacts/runs/live_20260417_model_D/p2/test_id/main_results.jsonl",
    "artifacts/runs/live_20260417_model_D/p2/test_id/main_trajectories.jsonl"
  ],
  "code_commit_hash": "55ed1f84e0d605a89605f7f2908d1d5e71499ddd",
  "input_manifest_hash": "996c73402bd1056e423c7ed83140a3443826708553f5c075b3300b521366b2c7",
  "jitter_policy": {
    "enabled": false,
    "scale": 0.0
  },
  "model_config": {
    "max_tokens": 6144,
    "model_id": "ep-20260319171349-jtz4c",
    "provider": "volcengine",
    "reasoning_effort": "default",
    "temperature": 0.0,
    "top_p": 1.0
  },
  "model_endpoint": "https://ark.cn-beijing.volces.com/api/v3",
  "model_name": "ep-20260319171349-jtz4c",
  "output_artifact_path": "artifacts/runs/live_20260417_model_D/p2/test_id/main_results.jsonl",
  "retry_policy": {
    "backoff_s": 0.0,
    "max_retries": 0
  },
  "run_id": "ep-20260319171349-jtz4c::996c73402bd1",
  "solver_config_version": "iterative_solver_v1",
  "solver_policy": {
    "action_schema_version": "action_schema_v2",
    "hard_timeout_s": 15.0,
    "max_attempts": 6,
    "policy_name": "iterative_design_search"
  },
  "system_prompt_hash": "c5d55a6b69fa0ed26effc8d04788d58f1d56e420846fd2eeecc55b22a1bbb476",
  "system_prompt_version": "volcengine_iterative_v1",
  "task_bank_path": "data/p2_v3r1/splits/p2_test_id_tasks.jsonl",
  "task_bank_version": "diagbench_p2_task_bank_v3r1",
  "timeout_policy": {
    "hard_timeout_s": 360.0,
    "request_timeout_s": 240.0
  },
  "timestamp": "2026-04-17T06:28:55.124444+00:00"
}
