{
  "artifact_paths": [
    "artifacts/runs/gemini31propreview_latest_p2_p3_p4_20260416/p3/dev/p3_results.jsonl",
    "artifacts/runs/gemini31propreview_latest_p2_p3_p4_20260416/p3/dev/p3_trajectories.jsonl"
  ],
  "code_commit_hash": "55ed1f84e0d605a89605f7f2908d1d5e71499ddd",
  "input_manifest_hash": "c415482dafdc145820a9adbbb15f969ea076e48a31b806384b35c5a22bd5707f",
  "jitter_policy": {
    "enabled": false,
    "scale": 0.0
  },
  "model_config": {
    "max_tokens": 1024,
    "model_id": "gemini-3.1-pro-preview",
    "provider": "aihubmix",
    "reasoning_effort": "default",
    "temperature": 0.0,
    "top_p": 1.0
  },
  "model_endpoint": "https://aihubmix.com/v1",
  "model_name": "gemini-3.1-pro-preview",
  "output_artifact_path": "artifacts/runs/gemini31propreview_latest_p2_p3_p4_20260416/p3/dev/p3_results.jsonl",
  "retry_policy": {
    "backoff_s": 0.0,
    "max_retries": 0
  },
  "run_id": "gemini-3.1-pro-preview::c415482dafdc",
  "solver_config_version": "iterative_solver_v1",
  "solver_policy": {
    "action_schema_version": "action_schema_v2",
    "hard_timeout_s": 15.0,
    "max_attempts": 6,
    "policy_name": "iterative_design_search"
  },
  "system_prompt_hash": "c5d55a6b69fa0ed26effc8d04788d58f1d56e420846fd2eeecc55b22a1bbb476",
  "system_prompt_version": "aihubmix_iterative_v1",
  "task_bank_path": "data/p3_v3r1/p3_dev_tasks.jsonl",
  "task_bank_version": "p3_v3r1",
  "timeout_policy": {
    "hard_timeout_s": 15.0,
    "request_timeout_s": 10.0
  },
  "timestamp": "2026-04-15T19:23:50.920420+00:00"
}
