{
  "artifact_paths": [
    "[WORKSPACE]/[REDACTED]/VEHBench-DiagBench/artifacts/runs/p1_v3r4_live/model_E/test_ood/p1_results.jsonl",
    "[WORKSPACE]/[REDACTED]/VEHBench-DiagBench/artifacts/runs/p1_v3r4_live/model_E/test_ood/p1_trajectories.jsonl"
  ],
  "code_commit_hash": "55ed1f84e0d605a89605f7f2908d1d5e71499ddd",
  "input_manifest_hash": "2f722250d599678fc93a60d91466d35238fd03ee92b32ad6aa8ae5a9cc1c46b2",
  "jitter_policy": {
    "enabled": false,
    "scale": 0.0
  },
  "model_config": {
    "max_tokens": 2048,
    "model_id": "claude-sonnet-4-6",
    "provider": "aihubmix",
    "reasoning_effort": "default",
    "temperature": 0.0,
    "top_p": 1.0
  },
  "model_endpoint": "https://aihubmix.com/v1",
  "model_name": "claude-sonnet-4-6",
  "output_artifact_path": "[WORKSPACE]/[REDACTED]/VEHBench-DiagBench/artifacts/runs/p1_v3r4_live/model_E/test_ood/p1_results.jsonl",
  "retry_policy": {
    "backoff_s": 0.0,
    "max_retries": 0
  },
  "run_id": "claude-sonnet-4-6::2f722250d599",
  "solver_config_version": "iterative_solver_v1",
  "solver_policy": {
    "action_schema_version": "action_schema_v2",
    "hard_timeout_s": 15.0,
    "max_attempts": 6,
    "policy_name": "iterative_design_search"
  },
  "system_prompt_hash": "c5d55a6b69fa0ed26effc8d04788d58f1d56e420846fd2eeecc55b22a1bbb476",
  "system_prompt_version": "aihubmix_iterative_v1",
  "task_bank_path": "[WORKSPACE]/[REDACTED]/VEHBench-DiagBench/new_data/p1/v3r4/test_ood_tasks.jsonl",
  "task_bank_version": "p1_v3r4_eight_subset",
  "timeout_policy": {
    "hard_timeout_s": 180.0,
    "request_timeout_s": 120.0
  },
  "timestamp": "2026-04-17T06:38:51.562923+00:00"
}
