{
  "artifact_paths": [
    "artifacts/runs/live_20260417_model_F/p3/test_ood/p3_results.jsonl",
    "artifacts/runs/live_20260417_model_F/p3/test_ood/p3_trajectories.jsonl"
  ],
  "code_commit_hash": "55ed1f84e0d605a89605f7f2908d1d5e71499ddd",
  "input_manifest_hash": "5ce0d7504c85f8a620ec223a06878aecaa0fd99a68a4bac815cedc332b232dab",
  "jitter_policy": {
    "enabled": false,
    "scale": 0.0
  },
  "model_config": {
    "max_tokens": 8192,
    "model_id": "model_F",
    "provider": "aihubmix",
    "reasoning_effort": "default",
    "temperature": 0.0,
    "top_p": 1.0
  },
  "model_endpoint": "https://aihubmix.com/v1",
  "model_name": "model_F",
  "output_artifact_path": "artifacts/runs/live_20260417_model_F/p3/test_ood/p3_results.jsonl",
  "retry_policy": {
    "backoff_s": 0.0,
    "max_retries": 0
  },
  "run_id": "model_F::5ce0d7504c85",
  "solver_config_version": "iterative_solver_v1",
  "solver_policy": {
    "action_schema_version": "action_schema_v2",
    "hard_timeout_s": 15.0,
    "max_attempts": 6,
    "policy_name": "iterative_design_search"
  },
  "system_prompt_hash": "c5d55a6b69fa0ed26effc8d04788d58f1d56e420846fd2eeecc55b22a1bbb476",
  "system_prompt_version": "aihubmix_iterative_v1",
  "task_bank_path": "data/p3_v3r1/p3_test_ood_tasks.jsonl",
  "task_bank_version": "p3_v3r1",
  "timeout_policy": {
    "hard_timeout_s": 450.0,
    "request_timeout_s": 300.0
  },
  "timestamp": "2026-04-16T19:22:57.080759+00:00"
}
